Person,Position,Project,Department,Task
Emma Wilson,Chief Innovation Officer,Innovation Lab,Executive,Leading innovation strategy
James Anderson,Mobile Developer,New Mobile Features,Development,Developing new features for the mobile app
Amelia Thomas,Customer Success Manager,Client Relationship Management,Customer Success,Managing key client relationships
Benjamin Jackson,Network Engineer,Network Upgrade,IT,Upgrading the company's network infrastructure
Charlotte Lee,Social Media Manager,Social Media Campaign,Marketing,Planning and executing social media campaigns
Henry Martinez,QA Engineer,Automated Testing Implementation,Quality Assurance,Developing automated test scripts
Emily Brown,Financial Analyst,Budget Forecasting,Finance,Creating budget forecasts and financial models
Daniel Garcia,Full-stack Developer,Internal Tool Development,Development,Building internal tools for the company
Grace Davis,Support Engineer,Customer Support,Support,Resolving technical issues for customers
Alexander Hernandez,Blockchain Developer,Blockchain Integration,Development,Integrating blockchain technology into existing systems
